{
  "schema": "xcodebuildmcp.output.build-run-result",
  "schemaVersion": "2",
  "didError": false,
  "error": null,
  "data": {
    "request": {
      "scheme": "CalculatorApp",
      "workspacePath": "example_projects/iOS_Calculator/CalculatorApp.xcworkspace",
      "derivedDataPath": "~/Library/Developer/XcodeBuildMCP/workspaces/XcodeBuildMCP-<HASH>/DerivedData/CalculatorApp-<HASH>",
      "configuration": "Debug",
      "platform": "iOS",
      "deviceId": "<UUID>",
      "target": "device"
    },
    "summary": {
      "status": "SUCCEEDED",
      "durationMs": 1234,
      "target": "device"
    },
    "artifacts": {
      "appPath": "~/Library/Developer/XcodeBuildMCP/workspaces/XcodeBuildMCP-<HASH>/DerivedData/CalculatorApp-<HASH>/Build/Products/Debug-iphoneos/CalculatorApp.app",
      "bundleId": "io.sentry.calculatorapp",
      "processId": 99999,
      "deviceId": "<UUID>",
      "buildLogPath": "~/Library/Developer/XcodeBuildMCP/workspaces/XcodeBuildMCP-<HASH>/logs/build_run_device_<TIMESTAMP>_pid<PID>.log"
    },
    "diagnostics": {
      "warnings": [],
      "errors": []
    }
  },
  "nextSteps": [
    "Stop app on device: xcodebuildmcp device stop --device-id <UUID> --process-id <PID>"
  ]
}
