{
  "schema": "xcodebuildmcp.output.build-run-result",
  "schemaVersion": "2",
  "didError": false,
  "error": null,
  "data": {
    "summary": {
      "status": "SUCCEEDED",
      "durationMs": 1234,
      "target": "simulator"
    },
    "artifacts": {
      "appPath": "~/Library/Developer/XcodeBuildMCP/workspaces/XcodeBuildMCP-<HASH>/DerivedData/CalculatorApp-<HASH>/Build/Products/Debug-iphonesimulator/CalculatorApp.app",
      "bundleId": "io.sentry.calculatorapp",
      "processId": 99999,
      "simulatorId": "<UUID>",
      "buildLogPath": "~/Library/Developer/XcodeBuildMCP/workspaces/XcodeBuildMCP-<HASH>/logs/build_run_sim_<TIMESTAMP>_pid<PID>.log",
      "runtimeLogPath": "~/Library/Developer/XcodeBuildMCP/workspaces/XcodeBuildMCP-<HASH>/logs/io.sentry.calculatorapp_<TIMESTAMP>_pid<PID>.log",
      "osLogPath": "~/Library/Developer/XcodeBuildMCP/workspaces/XcodeBuildMCP-<HASH>/logs/io.sentry.calculatorapp_oslog_<TIMESTAMP>_pid<PID>.log"
    },
    "diagnostics": {
      "warnings": [],
      "errors": []
    }
  },
  "nextSteps": [
    "Stop app in simulator: stop_app_sim({ simulatorId: \"<UUID>\", bundleId: \"io.sentry.calculatorapp\" })"
  ]
}
